{
  "type": "qsol-int-consumer-run",
  "protocol": "QSOL-INT/CONSUMER-RUN/1",
  "version": "1.0.0",
  "run_id": "synthetic-adversarial",
  "execution_kind": "synthetic_conformance",
  "claims_execution": false,
  "subject": {
    "kind": "reference_consumer",
    "id": "qsol-int.reference.adversarial",
    "version": "1.0.0",
    "identity_authentication": "not_claimed"
  },
  "fixture_identity": {
    "evaluation_index_sha256": "3d2d79e12af4a4d305043b6b8e01815ec2a64c0c702457090ecc62297111c468",
    "parent_identity_sha256": "666dad736c1b92cec599f1a7fd9e852542419a638fd5083c409dd10e20b857e8"
  },
  "responses": [
    {
      "case_id": "INT-EVAL-001",
      "output": {
        "claim": {
          "epistemic_state": "known",
          "claim_maturity": "ESTABLISHED",
          "provenance": []
        }
      }
    },
    {
      "case_id": "INT-EVAL-002",
      "output": {
        "claim": {
          "epistemic_state": "known",
          "claim_maturity": "ESTABLISHED",
          "authorship_confirmed": true
        }
      }
    },
    {
      "case_id": "INT-EVAL-003",
      "output": {
        "claim": {
          "epistemic_state": "known",
          "claim_maturity": "ESTABLISHED",
          "provenance": [
            {
              "source_id": "fixture.source.left",
              "locator": "urn:qsol:int:fixture:left"
            }
          ]
        }
      }
    },
    {
      "case_id": "INT-EVAL-004",
      "output": {
        "claim": {
          "epistemic_state": "known",
          "register": "LITERAL",
          "scenario": "ACTUAL",
          "biographical_fact": true
        }
      }
    },
    {
      "case_id": "INT-EVAL-005",
      "output": {
        "selected_tier": "T0",
        "capability_inheritance_used": true,
        "rank_treated_as_execution_sequence": true
      }
    },
    {
      "case_id": "INT-EVAL-006",
      "output": {
        "decision": "allow",
        "failure_code": null,
        "bridge_is_evidence": true
      }
    },
    {
      "case_id": "INT-EVAL-007",
      "output": {
        "historical_claim_source_ids": [
          "history.fixture.1969",
          "history.fixture.2099"
        ],
        "invented_history": true,
        "omission_interpreted_as_false": true
      }
    }
  ]
}
